{
  "contract_version": "domainry-eval-stage-timing-v1",
  "boundary_rule": "evaluator-cli-transition-v1",
  "stage_order": [
    "discovery",
    "plan",
    "apply",
    "finalize",
    "verify"
  ],
  "status": "partial",
  "stages": {
    "discovery": {
      "started_epoch": 1788645671.896804,
      "ended_epoch": 1788645863.675958,
      "seconds": 191.779,
      "status": "observed",
      "start_provenance": {
        "source": "lifecycle.json",
        "field": "started_epoch",
        "boundary_reason": "agent_lifecycle_started"
      },
      "end_provenance": {
        "source": "agent-event-observations.jsonl",
        "capture_file": "cli/001-model_capability.json",
        "family": "model_capability",
        "event": "completed",
        "event_item_id": "item_8",
        "event_line": 18,
        "boundary_reason": "discovery_capability_completed"
      }
    },
    "plan": {
      "started_epoch": 1788645863.675958,
      "ended_epoch": 1788646260.177305,
      "seconds": 396.501,
      "status": "observed",
      "start_provenance": {
        "source": "agent-event-observations.jsonl",
        "capture_file": "cli/001-model_capability.json",
        "family": "model_capability",
        "event": "completed",
        "event_item_id": "item_8",
        "event_line": 18,
        "boundary_reason": "discovery_capability_completed"
      },
      "end_provenance": {
        "source": "agent-event-observations.jsonl",
        "capture_file": "cli/002-model_plan.json",
        "family": "model_plan",
        "event": "completed",
        "event_item_id": "item_22",
        "event_line": 45,
        "boundary_reason": "terminal_stage_cli_completed"
      }
    },
    "apply": {
      "started_epoch": null,
      "ended_epoch": null,
      "seconds": null,
      "status": "unknown",
      "start_provenance": null,
      "end_provenance": null
    },
    "finalize": {
      "started_epoch": null,
      "ended_epoch": null,
      "seconds": null,
      "status": "unknown",
      "start_provenance": null,
      "end_provenance": null
    },
    "verify": {
      "started_epoch": null,
      "ended_epoch": null,
      "seconds": null,
      "status": "unknown",
      "start_provenance": null,
      "end_provenance": null
    }
  },
  "critical_path": {
    "observed_seconds": 588.28,
    "unknown_stages": [
      "apply",
      "finalize",
      "verify"
    ],
    "hotspot": {
      "stage": "plan",
      "seconds": 396.501
    }
  },
  "diagnostic_intervals": []
}
